{
  "schema_version": 1,
  "product_id": "svg-bundle-preflight",
  "product_url": "https://khiemnd2.gumroad.com/l/svg-bundle-preflight",
  "updated_at": "2026-08-27T15:06:30Z",
  "entries": [
    {
      "channel_id": "facebook-group-421148861654488",
      "destination_url": "https://www.facebook.com/groups/421148861654488/",
      "status": "published",
      "account_context": "Nguyễn Khiêm (Facebook)",
      "submitted_at": null,
      "published_at": null,
      "post_url": "https://www.facebook.com/groups/421148861654488/posts/2600872557015430/",
      "last_verified_at": "2026-08-27T15:06:30Z",
      "evidence_notes": "The post was publicly visible; the exact historical publish timestamp was not recovered."
    }
  ]
}
